{
  "date": "2026-05-16",
  "categories": [
    {
      "name": "POLITICS",
      "questions": [
        {
          "value": 200,
          "clue": "In 1967 Richard Hatcher became the 1st elected black mayor of this steel-producing Indiana city",
          "choices": [
            "South Bend",
            "Fort Wayne",
            "Hammond",
            "Gary"
          ],
          "correctIndex": 3
        },
        {
          "value": 400,
          "clue": "In 1871, cartoonist Thomas Nast used this animal as symbol of NYC's corrupt Tammany Hall",
          "choices": [
            "Tiger",
            "A donkey",
            "An elephant",
            "A snake"
          ],
          "correctIndex": 0
        },
        {
          "value": 600,
          "clue": "Called the 1st national party in the U.S., it was organized by Alexander Hamilton",
          "choices": [
            "The Democratic-Republicans",
            "Federalists",
            "The Whigs",
            "The Anti-Masonic Party"
          ],
          "correctIndex": 1
        },
        {
          "value": 800,
          "clue": "Until appointed Defense Secretary, Dick Cheney was this state's only representative in the House",
          "choices": [
            "Wyoming",
            "Montana",
            "Idaho",
            "North Dakota"
          ],
          "correctIndex": 0
        },
        {
          "value": 1000,
          "clue": "In 1986, Salvador Laurel, already vice-president, was also appointed foreign minister & prime minister of this country",
          "choices": [
            "The Philippines",
            "Indonesia",
            "Malaysia",
            "Thailand"
          ],
          "correctIndex": 0
        }
      ]
    },
    {
      "name": "STATE BIRDS",
      "questions": [
        {
          "value": 200,
          "clue": "Ohio: This redbird",
          "choices": [
            "A bluebird",
            "A goldfinch",
            "A cardinal",
            "A robin"
          ],
          "correctIndex": 2
        },
        {
          "value": 400,
          "clue": "This pouched state bird of Louisiana has been designated an endangered species in North America",
          "choices": [
            "The pelican",
            "The egret",
            "The heron",
            "The ibis"
          ],
          "correctIndex": 0
        },
        {
          "value": 600,
          "clue": "Texas adopted this mimic as its state bird in 1927; Tennessee mimicked the pick in 1933",
          "choices": [
            "A bluebird",
            "A mockingbird",
            "A cardinal",
            "A meadowlark"
          ],
          "correctIndex": 1
        },
        {
          "value": 800,
          "clue": "This western meadowlark is the state bird of this Cornhusker State",
          "choices": [
            "Kansas",
            "Nebraska",
            "Iowa",
            "South Dakota"
          ],
          "correctIndex": 1
        },
        {
          "value": 1000,
          "clue": "Both Montana & Nebraska have the western type of this bird",
          "choices": [
            "The robin",
            "The bluebird",
            "The oriole",
            "Meadowlark"
          ],
          "correctIndex": 3
        }
      ]
    },
    {
      "name": "BOB DYLAN",
      "questions": [
        {
          "value": 200,
          "clue": "Bob was born in Minnesota with this last name",
          "choices": [
            "Zimmermann",
            "Ziegler",
            "Zuckerman",
            "Zimmerman"
          ],
          "correctIndex": 3
        },
        {
          "value": 400,
          "clue": "Song that Jann Wenner's magazine ranked the greatest ever",
          "choices": [
            "\\\"Like A Rolling Stone\\\"",
            "\"Blowin' in the Wind\"",
            "\"The Times They Are A-Changin'\"",
            "\"Mr. Tambourine Man\""
          ],
          "correctIndex": 0
        },
        {
          "value": 600,
          "clue": "Bob's son, who fronted The Wallflowers",
          "choices": [
            "Jesse Dylan",
            "Samuel Dylan",
            "Jakob Dylan",
            "Desi Dylan"
          ],
          "correctIndex": 2
        },
        {
          "value": 800,
          "clue": "City Bob made news by not being in December 10, 2016",
          "choices": [
            "Oslo",
            "London",
            "Stockholm",
            "New York"
          ],
          "correctIndex": 2
        },
        {
          "value": 1000,
          "clue": "Folk artist who sang \"Diamonds & Rust\" about her fling with Bob",
          "choices": [
            "Joni Mitchell",
            "Joan Baez",
            "Judy Collins",
            "Mary Travers"
          ],
          "correctIndex": 1
        }
      ]
    }
  ],
  "dailyDouble": {
    "category": "TRUCKIN\\'",
    "clue": "Take this company's Titan to a new frontier",
    "choices": [
      "Toyota",
      "Nissan",
      "Ford",
      "Chevrolet"
    ],
    "correctIndex": 1
  },
  "bonusRound": {
    "category": "STATES' LOWEST POINTS",
    "clue": "Idaho's lowest point lies in Nez Perce County along this river",
    "choices": [
      "The Salmon River",
      "The Snake River",
      "The Clearwater River",
      "The Boise River"
    ],
    "correctIndex": 1
  }
}
