{
  "date": "2027-06-12",
  "categories": [
    {
      "name": "BIRTH MONTH FLOWERS",
      "questions": [
        {
          "clue": "Every month has a birthstone as well as a birth flower; January has this one",
          "choices": [
            "the rose",
            "the tulip",
            "the carnation",
            "the orchid"
          ],
          "correctIndex": 2,
          "value": 200
        },
        {
          "clue": "There are thousands of varieties of this April birth flower, including the Shasta & the Gerbera",
          "choices": [
            "sunflower",
            "bluebell",
            "zinnia",
            "daisy"
          ],
          "correctIndex": 3,
          "value": 400
        },
        {
          "clue": "Even if you live on a mountain, this multi-word flower is yours if you were born in May",
          "choices": [
            "lily of the valley",
            "sweet pea",
            "bluebonnet",
            "hollyhock"
          ],
          "correctIndex": 0,
          "value": 600
        },
        {
          "clue": "Choices for August include this flower; don't fall asleep in a field of them",
          "choices": [
            "poppies",
            "sunflowers",
            "lilacs",
            "marigolds"
          ],
          "correctIndex": 0,
          "value": 800
        },
        {
          "clue": "For February, you can choose this flower whose color matches the month's birthstone",
          "choices": [
            "the rose",
            "the violet",
            "the daisy",
            "the tulip"
          ],
          "correctIndex": 1,
          "value": 1000
        }
      ]
    },
    {
      "name": "OLYMPIC TRACK & FIELD RECORDS",
      "questions": [
        {
          "clue": "2 hours, 6 minutes, 32 seconds by Samuel Kamau Wansiru",
          "choices": [
            "the marathon",
            "the 10,000 meters",
            "the 5,000 meters",
            "the 3,000 meters steeplechase"
          ],
          "correctIndex": 0,
          "value": 200
        },
        {
          "clue": "29' 2 1/2\" by Bob Beamon",
          "choices": [
            "the high jump",
            "the long jump",
            "the triple jump",
            "the pole vault"
          ],
          "correctIndex": 1,
          "value": 400
        },
        {
          "clue": "297' 1 3/4\" by Andres Thorkildsen",
          "choices": [
            "the discus",
            "the hammer",
            "the javelin",
            "the shot put"
          ],
          "correctIndex": 2,
          "value": 600
        },
        {
          "clue": "3 minutes, 32.07 seconds by Noah Ngeny",
          "choices": [
            "the 800 meters",
            "the 5,000 meters",
            "the 1,500 meters",
            "the 10,000 meters"
          ],
          "correctIndex": 2,
          "value": 800
        },
        {
          "clue": "8,893 points by Roman Sebrle",
          "choices": [
            "the pentathlon",
            "the decathlon",
            "the pole vault",
            "the shot put"
          ],
          "correctIndex": 1,
          "value": 1000
        }
      ]
    },
    {
      "name": "20th CENTURY USA",
      "questions": [
        {
          "clue": "In 1952 this toy company founded by the Hassenfeld brothers introduced Mr. Potato Head",
          "choices": [
            "Mattel",
            "Hasbro",
            "Lego",
            "Milton Bradley"
          ],
          "correctIndex": 1,
          "value": 200
        },
        {
          "clue": "In June 1934 this father of a future president was named chairman of the SEC",
          "choices": [
            "Joseph Kennedy",
            "John F. Kennedy",
            "Robert Kennedy",
            "Eleanor Roosevelt"
          ],
          "correctIndex": 0,
          "value": 400
        },
        {
          "clue": "During the 1930s, Dorothea Lange & Margaret Bourke-White established themselves in this profession",
          "choices": [
            "journalism",
            "photography",
            "reporting",
            "filmmaking"
          ],
          "correctIndex": 1,
          "value": 600
        },
        {
          "clue": "On Sept. 18, 1975 this fugitive heiress was captured by the FBI in a San Francisco apartment",
          "choices": [
            "Elizabeth Smart",
            "Amy Fisher",
            "Pamela Smart",
            "Patty Hearst"
          ],
          "correctIndex": 3,
          "value": 800
        },
        {
          "clue": "In 1984 this civil rights leader gained the release of 22 Americans & 26 Cubans detained in Cuban prisons",
          "choices": [
            "Rev. Jesse Jackson",
            "Rev. Al Sharpton",
            "Rev. Martin Luther King",
            "Cory Booker"
          ],
          "correctIndex": 0,
          "value": 1000
        }
      ]
    }
  ],
  "dailyDouble": {
    "clue": "A guy who hitches horses, or one who's getting hitched himself",
    "choices": [
      "a bride",
      "a groomsmen",
      "a bachelor",
      "a groom"
    ],
    "correctIndex": 3,
    "category": "WORDS OF LOVE"
  },
  "bonusRound": {
    "clue": "This Maori diva from New Zealand sang with Nelson Riddle and at Prince Charles's wedding",
    "choices": [
      "Kiri Te Kanawa",
      "Enya",
      "Bic Runga",
      "Sharon Cuneta"
    ],
    "correctIndex": 0,
    "category": "GREAT DAMES"
  }
}